{
  "scanDocumentId": "50770ba9-37ea-4713-8cab-fe5bf1202716",
  "income": {
  },
  "benefits": {
    "claimed": true,
    "type": "free text describing benefits type"
  },
  "nationalInsuranceNumber": "AE123456C",
  "sjpAllFinancialMeans": {
    "caseId": "8a2b4656-f2b8-4cdd-abb4-46376db24bbf",
    "defendantId": "50770ba9-37ea-4713-8cab-fe5bf1202716",
    "income": {
    },
    "benefits": {
      "claimed": true,
      "type": "free text describing benefits type"
    }
  }
}

